Timestamp,Date,Describe,Category
2/18/2026 6:17:30,2/17/2026,"What is happening since Abhishek has said that undivided attention.
I have started withdrawing from places 
a. business plan (No next steps defined)
b. current form (prep for Kashyap or Vinesh)
c. reducing to make comments in others work
d. I also felt that this current form is not happening properly.

Instead I have started focusing more on video and trying to streamline it.

I have also thought that Capture is not performing well and constantly under thoughts that it is not working and I am doing something wrong.

I have also started thinking that he does not value this level up work as much because I know the way he works and thinks about people growth.

What I need is understand is
a. Things are progressing and working fine. Capture is doing great except few cases. The new PCB is great and testing is going on.
b. I need to keep improving my level up role and keep making things better at company level.
c. I first need to get capture handle and for time being give it more priority. 
d. I do not need to undermine myself or my work at all. If I do that that will be biggest blow to my work.

So finally
a. Video is exciting we are working on new bets and it can increase our moat.
b. Capture is progressing and we are making it solid day by day. We are also building team.
c. Level Up has done great in last year we need to put in more efforts here.
d. Start working on plan for next steps.",Thoughts
2/22/2026 8:18:33,2/18/2026,"Kaka was calling me to complete car loan and he sent a series of messages.
Payal read that he was saying that I was doing Jugaad she did not like it and she got upset.
I went to take Shaurya from a birthday party. She did not come.
I told kaka that I am not doing jugaad I have not used a single money that he has sent.
I do not need car but there is one car if it comes I can take back my car.
I took some things in heat of the moment.",Event
2/22/2026 8:24:04,2/19/2026,"19th Feb - Our 19th Anniversary.
There was no celebratory mood from Payal as she was constantly thinking that how can someone say me for what I have not done.
She was also disparaging on why she got married.
This morning I also got message from Bank that my SGB limit is over and I need to pay 30k there. So I was also under some tension of money.
I came back from office after first half had a good sleep in afternoon.
No fixed plans in evening she was not feeling well just went out on a ride and she had a sandwich.
I also called dad during afternoon and told him few things which I did not like mainly around car and current situation of Hardik. What he told me stayed with me.
a. I will not use car.
b. Hardik will not be able to buy, how can he run house in 65k.
c. Sorry that I am telling you this.
d. You have spent so much on house it is hard to believe that you are in difficult situation from finance.
e. I am happy I have seen worse days than this in my life so I am happy with whatever I have.",Event
2/22/2026 8:26:10,2/20/2026,"We both had to go to school.
Aanshi had exams, so I dropped her.
We both left early from home.
Were together on lunch.
Things came normal.",Event
2/25/2026 5:53:28,2/24/2026,When I came back from USA loved staying there and somethings that I liked there and decided to follow it here. Yesterday one such thing happened when I was at Zudio. How I could have started yelling or pressing the counter person to do something but I waited patiently like a US citizen and waited for my turn to come.,Story
2/25/2026 6:00:02,2/24/2026,"Shaurya yesterday told me that I get frustrated when the opposite player does celebration on winning a point in badminton and I then get angry. I keep telling him that you should focus on your game getting frustrated or angry is not helping you improve your game.

“When the other player celebrates, I imagine it feels irritating or distracting. I want you to enjoy the game and stay strong. What do you think could help you stay focused even when that happens?”

Now you're not dismissing emotion.
You're coaching emotional regulation.",OFNR - Other
2/25/2026 6:06:02,2/24/2026,"“When I see you getting angry after the opponent celebrates (O), I feel concerned and protective (F), because I value your growth and resilience (N). Would you be open to exploring what might help you stay strong in those moments? (R)”

3 ways
Curiosity
Skill building
Normalize and Guide",OFNR - Self
2/25/2026 6:09:39,2/24/2026,"“When I see a lot of sweets being eaten, I feel concerned because I care about your health and athletic growth. I’d like us to think together about what balance would support your energy and strength.”",OFNR - Self
2/25/2026 6:14:44,2/24/2026,"I became parent twice yesterday
- do not get angry while playing it is not good focus on your game
- do not eat more than 2 sweets a day I want you to become a great athlete.

No NVC more of moral guidance, control, correction.",Story
2/25/2026 22:03:43,2/25/2026,"The only way to solve and win through problem is to work towards it.
Today I felt so good when I started making consistent effort of owning and sharing capture work. Another subtle thing is when you start overcoming your fears.
- subsidy discussion
- Maharshi KT
- Production plan discussion
- Claude Code trial and understanding Python Code.
- Do whatever it takes

Again all of what I may have read is coming to life;.",Story
2/25/2026 22:28:14,2/25/2026,Today morning I took good care of her and she could feel it when I ensured that she gets time for call and she can do exercise even she could feel that care also we talked about trip on the walk. I am able to sense her feelings and needs.,Payal Letter / Loving Her
2/25/2026 22:34:15,2/25/2026,"When Aanshi started teasing me by keeping lights on and laughing at it.
""When you turned the lights on to tease me, I felt hurt and a little dismissed, because this value of not wasting resources is something I genuinely care about and it matters to me that you understand that, even if you don't share it the same way.""",OFNR - Self
2/26/2026 22:20:50,2/26/2026,"All performances are not same.
We keep talking about recognition at CricHeroes and when we see from onset we feel that this performance someone must buy and then when we talk to users we learn that they do not value individual match performances, normal tournament match performances, they value critical tournament match performances and if they already perform well they also do not value all good performances.",Story
2/26/2026 22:22:27,2/26/2026,"How older memories or learnings make it so fulfilling.

Today I was taking KT from Maharshi and it reminded me of few things from my college like
Plan and elevation
Isometric and orthogonal projection
Strength of materials

Even some school fundamentals
Copper better conductor

How science and building physical objects is different than building softwares.",Story
2/26/2026 22:24:02,2/26/2026,"AI as a powerful tool

How humans have always got powerful tools in history and they have helped mankind.
AI looks like most powerful tool till date and even powerful than human.
Let us see how humans use it and benefit and make larger good.

How software as a line came and how software will eat itself and comoditize.
How other engineerings will become more valuable.",Story
3/1/2026 15:58:02,2/24/2026,"I used to think that turning off all the unnecessary lights and kept telling that to everyone. This is what I inherited from my parents.
Now that day it stuck me that kids do not think that way. 
there is also another way to see lights giving beauty to home.
So let me also not think from only savings point of view.
So now I do not make fuss of it some times I keep them on and not tell everyone to keep it off.",Thoughts
3/8/2026 1:03:36,3/6/2026,"Your OFNR:
Observation: The TV time extended beyond 20 minutes and I started feeling unproductive.
Feeling: Restless. Anxious. Perhaps a quiet guilt about time passing without purpose.
Need: To use time meaningfully. To not feel like things are slipping out of order.
Request to yourself: Can I notice this restlessness without acting on it immediately? Can I sit with the discomfort for a little while in service of something equally valuable — which is just being with my children?",OFNR - Self
3/8/2026 1:04:29,3/6/2026,"Aanshi
Observation: Papa was watching TV with us and then suddenly shifted to checking on my habits mid-enjoyment.
Feeling: Dismissed. Disrupted. Perhaps a little sad — because she was enjoying him being there, not just the TV.
Need: To feel that this time with Papa is safe and uninterrupted. That she is enough reason for him to stay present.
Request she couldn't articulate but was underneath her reaction: ""Just be here with me. Nothing else right now.""
",OFNR - Other